ID,Title,Column,Column Title,Scheduled,Deadline,Priority,Tags,Description,Order,MetaData
0,Welcome to CanBan — overview,todo,To do,2025-11-13T08:00:00.000Z,2025-11-30T17:00:00.000Z,medium,guide introduction,"CanBan combines Kanban and Calendar. Cards are tasks; columns are workflow phases (To do, In progress, Done, Deleted). Each card shows icons for priority, Scheduled and Deadline. Continue with the next cards to learn all features.",0,"{""columns"":[{""id"":""todo"",""title"":""To do"",""color"":""bg-slate-100"",""isDone"":false},{""id"":""inProgress"",""title"":""In progress"",""color"":""bg-blue-50"",""isDone"":false},{""id"":""done"",""title"":""Done"",""color"":""bg-green-50"",""isDone"":true},{""id"":""deleted"",""title"":""Deleted"",""color"":""bg-cyan-50"",""isDone"":true}],""settings"":{""dividerLeftLimit"":20,""dividerRightLimit"":80},""viewMode"":""both"",""splitRatio"":51,""exportDate"":""2025-12-03T23:03:03.410Z""}"
1,Create and edit tasks,todo,To do,2025-11-14T09:00:00.000Z,2025-12-01T18:00:00.000Z,high,create edit details,"Use the + button in a column header to add a card. Click a card to open details: change title, description, priority, tags, Scheduled and Deadline. Save to apply; delete from the modal if no longer needed.",1,
2,Drag & drop and column options,inProgress,In progress,2025-11-15T10:00:00.000Z,2025-12-05T17:00:00.000Z,medium,drag drop columns compact sort,"Drag cards to reorder or move between columns. Drag a column header to reorder columns. Click a column title to rename. In the ••• menu: Compact view, Sort by priority, Add left/right, Delete. Preferences are stored per column.",0,
3,Calendar and split view,done,Done,2025-11-16T09:30:00.000Z,2025-12-10T17:30:00.000Z,low,calendar split day week month,"From the top controls choose Kanban, Calendar or Both. In split view drag the central handle to resize. In Calendar switch between Day/Week/Month, jump to Today, and open tasks from the grid.",0,
4,"Undo/Redo, backup and trash",deleted,Deleted,2025-11-17T08:30:00.000Z,2025-12-12T08:30:00.000Z,very_low,history export import localStorage,Use Undo/Redo to return to a previous state. Export a JSON backup and import it to restore data. Data is auto-saved in the browser. The Deleted column can act as a trash; or delete directly from the modal. Long titles are truncated; descriptions wrap.,0,